id,gender,masterCategory,subCategory,year,usage,productDisplayName,filename,articleType,baseColour,season
58988,Women,Personal Care,Fragrance,2017.0,Casual,Cavallini Women Deo,58988.jpg,Deodorant,Green,Spring
50874,Women,Apparel,Saree,2012.0,Ethnic,Prafful Purple & Green Printed Sari,50874.jpg,Sarees,Red,Fall
43646,Women,Apparel,Dress,2012.0,Casual,ONLY Women Blue Dress,43646.jpg,Tops,Blue,Summer
17060,Women,Accessories,Belts,2015.0,Casual,Lino Perros Women Flower Print Red Belt,17060.jpg,Belts,Multi,Winter
21123,Men,Apparel,Topwear,2011.0,Casual,s.Oliver Men Check Purple Sweater,21123.jpg,Shirts,Blue,Fall
3370,Women,Footwear,Shoes,2012.0,Sports,Asics Women Gel Cushioning Running Grey Pink Shoe,3370.jpg,Casual Shoes,White,Fall
2142,Men,Apparel,Topwear,2011.0,Casual,Basics Men Grey Tshirt,2142.jpg,Tshirts,Grey,Fall
53461,Women,Apparel,Innerwear,2015.0,Casual,Amante Black T-Shirt Bra,53461.jpg,Bra,Black,Summer
5178,Men,Apparel,Topwear,2011.0,Casual,Rolling Stone Men's The Rolling Stones Navy T-shirt,5178.jpg,Tshirts,Black,Summer
40990,Girls,Apparel,Topwear,2012.0,Casual,Palm Tree Girls Milan White Top,40990.jpg,Tops,White,Summer
55873,Women,Personal Care,Nails,2017.0,Casual,Colorbar Pretty Please 2 Nail Lacquer 79V,55873.jpg,Nail Polish,Pink,Spring
40087,Men,Apparel,Topwear,2012.0,Casual,ADIDAS Men Black Polo T-Shirt,40087.jpg,Tshirts,Black,Summer
52570,Women,Accessories,Bags,2012.0,Casual,Mod'acc Women Grey Clutch,52570.jpg,Clutches,Blue,Summer
34052,Boys,Apparel,Bottomwear,2012.0,Casual,Gini and Jony Boys Yellow 3/4 Length Pants,34052.jpg,Capris,Yellow,Summer
33713,Men,Footwear,Flip Flops,2012.0,Casual,Cobblerz Men Red Flip Flops,33713.jpg,Flip Flops,Brown,Summer
36699,Men,Personal Care,Fragrance,2017.0,Casual,Hugo Boss Men Perfume,36699.jpg,Perfume and Body Mist,White,Spring
45896,Men,Accessories,Watches,2016.0,Casual,Maxima Ssteele Men White Dial Watch,45896.jpg,Watches,Silver,Winter
56542,Women,Personal Care,Eyes,2017.0,,Streetwear Wonder Lash Mascara,56542.jpg,Lipstick,Black,Spring
56989,Women,Footwear,Shoes,2012.0,Casual,HM Women Brown Flats,56989.jpg,Heels,Black,Fall
19973,Men,Accessories,Headwear,2011.0,Casual,United Colors of Benetton Men Solid Grey Cap,19973.jpg,Caps,Blue,Summer
46382,Men,Apparel,Topwear,2012.0,Casual,ADIDAS Men Blue Printed T-shirt,46382.jpg,Tshirts,Blue,Summer
4521,Men,Footwear,Shoes,2011.0,Sports,Puma Men's Axis White Black Lime Shoe,4521.jpg,Sports Shoes,White,Summer
36673,Women,Accessories,Bags,2012.0,Casual,Paridhan Women Purple Handbag,36673.jpg,Handbags,Red,Summer
15892,Girls,Footwear,Shoes,2013.0,Casual,Warner Bros Tweety Girls Blue and White Casual Shoes,15892.jpg,Casual Shoes,White,Fall
27042,Women,Accessories,Bags,2012.0,Casual,Yelloe Black Animal Print Clutch,27042.jpg,Clutches,Black,Summer
22984,Men,Footwear,Shoes,2011.0,Sports,FILA Men White Temptation Sports Shoes,22984.jpg,Sports Shoes,White,Fall
17270,Men,Apparel,Topwear,2011.0,Casual,U.S. Polo Assn. Men Black Polo Tshirt,17270.jpg,Tshirts,Black,Fall
21316,Women,Accessories,Eyewear,2016.0,Casual,Celine Dion Women Brown Frame Sunglasses,21316.jpg,Sunglasses,Black,Winter
28516,Men,Apparel,Topwear,2012.0,Sports,Nike Men Home Red Jersey,28516.jpg,Tshirts,Red,Summer
17100,Women,Accessories,Wallets,2015.0,Casual,Lino Perros Women Flower Rust Wallet,17100.jpg,Wallets,Brown,Summer
21626,Women,Apparel,Innerwear,2014.0,Casual,Enamor Women Smooth White Bra,21626.jpg,Bra,White,Winter
23047,Women,Apparel,Topwear,2011.0,Casual,Arrow Woman Charcoal Solid Sweater,23047.jpg,Sweaters,Navy Blue,Fall
34516,Women,Footwear,Flip Flops,2012.0,Casual,ADIDAS Women Caroni Purple Flip Flops,34516.jpg,Flip Flops,Blue,Summer
10507,Women,Apparel,Topwear,2011.0,Casual,Flying Machine Women Pink Polo Tshirts,10507.jpg,Tshirts,Black,Summer
59941,Men,Footwear,Shoes,2013.0,Casual,Vans Men Navy Blue Casual Shoes,59941.jpg,Casual Shoes,Black,Fall
13459,Men,Apparel,Topwear,2011.0,Casual,United Colors of Benetton Men Check Blue Shirts,13459.jpg,Shirts,Green,Fall
15913,Men,Apparel,Topwear,2011.0,Formal,Black Coffee Men Stripes White Shirt,15913.jpg,Shirts,White,Fall
53628,Men,Accessories,Watches,2016.0,Casual,Q&Q Men Black Dial Analogue Watch C152J202Y,53628.jpg,Watches,Black,Winter
59973,Women,Apparel,Dress,2012.0,Casual,Avirate Women Navy Blue Dress,59973.jpg,Dresses,Black,Summer
28100,Men,Apparel,Innerwear,2016.0,Casual,Jockey COMFPLUS Men Black Y Front Briefs 8004,28100.jpg,Briefs,Navy Blue,Summer
31267,Men,Apparel,Topwear,2012.0,Casual,Puma Men Hamburg Graphic Red T-shirt,31267.jpg,Tshirts,Red,Fall
42832,Women,Accessories,Bags,2012.0,Casual,French Connection Women Taupe & Brown Handbag,42832.jpg,Handbags,Brown,Winter
20069,Women,Accessories,Belts,2011.0,Casual,United Colors of Benetton Women Solid Black Belt,20069.jpg,Wallets,Black,Summer
48862,Women,Accessories,Jewellery,2012.0,Casual,Lucera Women Silver Pendant,48862.jpg,Pendant,Silver,Summer
6891,Women,Apparel,Topwear,2011.0,Casual,Forever New Women Long Black Jacket,6891.jpg,Jackets,Brown,Summer
55574,Women,Personal Care,Makeup,2017.0,Casual,Revlon Photo Ready Medium/ Deep Compact 03,55574.jpg,Compact,Skin,Spring
44125,Women,Personal Care,Fragrance,2017.0,Casual,Hugo Women Deep Red Perfume,44125.jpg,Perfume and Body Mist,Red,Summer
48320,Women,Accessories,Jewellery,2012.0,Casual,Pitaraa Silver Omelette Thin Bracelet,48320.jpg,Bracelet,Silver,Summer
59221,Women,Accessories,Watches,2016.0,Casual,Titan Women Gold Watch,59221.jpg,Watches,White,Winter
20128,Women,Apparel,Topwear,2011.0,Casual,Wrangler Women Checkerd Blue Shirt,20128.jpg,Shirts,Blue,Fall
49129,Women,Personal Care,Makeup,2017.0,Casual,Deborah Medium Beige 24 Ore Perfect Concealer 4,49129.jpg,Lipstick,Skin,Spring
51031,Women,Apparel,Innerwear,2017.0,Casual,Enamor White Bra,51031.jpg,Bra,Skin,Summer
18716,Women,Apparel,Topwear,2011.0,Casual,Arrow Woman Shanna Black Top,18716.jpg,Tops,Black,Summer
55970,Women,Personal Care,Lips,2019.0,Casual,Colorbar Velvet Matte Hearts & Tarts Lipstick 80V,55970.jpg,Lipstick,Pink,Spring
54325,Women,Apparel,Innerwear,2017.0,Casual,Garfield Women White & Pink Bra,54325.jpg,Bra,White,Winter
12477,Men,Footwear,Shoes,2012.0,Formal,Clarks Men Leather Brown Formal Shoes,12477.jpg,Casual Shoes,Black,Winter
33147,Girls,Apparel,Bottomwear,2012.0,Casual,Gini and Jony Girls Blue Jeans,33147.jpg,Jeans,Blue,Summer
28095,Men,Apparel,Innerwear,2016.0,Casual,Jockey MC Men Grey Melange Y Front Briefs 8003,28095.jpg,Briefs,Grey Melange,Summer
12220,Men,Apparel,Bottomwear,2013.0,Formal,Basics Men Solid Black Trousers,12220.jpg,Trousers,Black,Fall
45037,Men,Accessories,Watches,2016.0,Casual,Maxima Attivo Men White Dial Watch,45037.jpg,Watches,White,Winter
31824,Men,Accessories,Watches,2016.0,Casual,Titan Men Black Dial Watch,31824.jpg,Watches,Black,Winter
34590,Women,Apparel,Topwear,2012.0,Casual,Tonga Women Printed Red Top,34590.jpg,Tops,Blue,Summer
15574,Boys,Apparel,Topwear,2011.0,Casual,Chhota Bheem Kids Boys Best Friends Group TShirt,15574.jpg,Tshirts,Navy Blue,Summer
27943,Men,Apparel,Innerwear,2016.0,Casual,Jockey Men Comfort Stretch Charcoal Bikini Brief,27943.jpg,Briefs,Charcoal,Summer
41527,Men,Accessories,Bags,2012.0,Casual,Basics Men Brown Messenger Bag,41527.jpg,Handbags,Black,Summer
38020,Women,Accessories,Watches,2016.0,Casual,Q&Q Women Steel Dial Watch,38020.jpg,Watches,White,Winter
55822,Women,Apparel,Loungewear and Nightwear,2017.0,Casual,SDL by Sweet Dreams Women White & Pink Printed Night Suit S11-3231,55822.jpg,Briefs,White,Summer
11369,Women,Apparel,Topwear,2011.0,Casual,United Colors Of Benetton Women Light Winter Pink Tops,11369.jpg,Tops,Maroon,Summer
43562,Men,Accessories,Socks,2012.0,Casual,Puma Men White Pack of 3 Socks,43562.jpg,Socks,White,Summer
6684,Women,Apparel,Topwear,2011.0,Casual,UCB Women's Pleat At Back Yellow T-shirt,6684.jpg,Tshirts,White,Summer
36789,Men,Accessories,Watches,2016.0,Casual,Maxima Men Silver Dial Attivo Watch,36789.jpg,Watches,Silver,Winter
29100,Unisex,Accessories,Bags,2012.0,Casual,Puma Unisex Black Backpack,29100.jpg,Handbags,Black,Summer
4162,Women,Apparel,Topwear,2011.0,Casual,Inkfruit Women's To do List Sea Green T-shirt,4162.jpg,Tshirts,Green,Summer
3167,Women,Footwear,Shoes,2011.0,Sports,Nike Women Main Draw White Blue Shoe,3167.jpg,Casual Shoes,White,Fall
4239,Men,Apparel,Topwear,2011.0,Casual,Probase Men's Musical Figures Grey T-shirt,4239.jpg,Tshirts,Navy Blue,Summer
56114,Women,Personal Care,Lips,2017.0,Casual,Colorbar Feelin Rosey Lip Pot 011,56114.jpg,Lip Gloss,White,Spring
21526,Women,Accessories,Bags,2015.0,Casual,Kiara Women Glossy Red Handbag,21526.jpg,Handbags,Red,Summer
9351,Men,Accessories,Socks,2011.0,Casual,Puma Men Sport Pack of 3 Pairs Black Sock,9351.jpg,Socks,Black,Summer
32066,Men,Apparel,Innerwear,2016.0,Casual,Playboy Men Navy Blue Brief,32066.jpg,Briefs,Black,Summer
22686,Unisex,Accessories,Wallets,2015.0,Casual,Wildcraft Unisex Nylon Grey Passport Pouch,22686.jpg,Laptop Bag,Black,Summer
27301,Women,Apparel,Topwear,2011.0,Ethnic,Mother Earth Women Printed Orange Kurta,27301.jpg,Kurtas,Red,Fall
26587,Men,Footwear,Shoes,2012.0,Sports,Puma Men Vibrant VI Black Sports Shoes,26587.jpg,Casual Shoes,Black,Summer
4916,Women,Apparel,Topwear,2011.0,Casual,Gini and Jony Girl's Vollie White Infant Kidswear,4916.jpg,Tshirts,White,Summer
16298,Men,Apparel,Topwear,2011.0,Casual,Peter England Men Check Navy Blue Shirt,16298.jpg,Shirts,Blue,Fall
1592,Men,Footwear,Shoes,2011.0,Sports,Kipsta Men's Superfit Football Red Shoe,1592.jpg,Casual Shoes,Red,Summer
25402,Men,Accessories,Mufflers,2012.0,Casual,Nike Men Striped Manchester United Red Scarf,25402.jpg,Mufflers,Red,Summer
18624,Men,Apparel,Topwear,2011.0,Casual,Puma Men Lifestyle Knitted Cream Sweaters,18624.jpg,Tshirts,White,Fall
51870,Men,Apparel,Topwear,2012.0,Casual,Mark Taylor Beige Printed T-shirt,51870.jpg,Tshirts,White,Summer
1802,Men,Footwear,Shoes,2011.0,Sports,Quechua Men's Arpenaz Flex Yellow Shoe,1802.jpg,Casual Shoes,Brown,Summer
4872,Men,Apparel,Topwear,2016.0,Casual,Levis Kids Boy's Danio Grey Teens Kidswear,4872.jpg,Tshirts,White,Summer
45972,Women,Apparel,Topwear,2012.0,Casual,Tokyo Talkies Women Red Printed Top,45972.jpg,Tshirts,Red,Summer
35313,Women,Accessories,Jewellery,2016.0,Ethnic,Fabindia Women Anusuya Silver Earrings,35313.jpg,Earrings,Silver,Winter
24274,Men,Apparel,Topwear,2012.0,Casual,Quiksilver Men Basic Navy Blue T-shirt,24274.jpg,Tshirts,Blue,Fall
27739,Women,Accessories,Bags,2015.0,Casual,Murcia Black Handbag,27739.jpg,Handbags,Black,Winter
7120,Unisex,Accessories,Bags,2015.0,Casual,Wildcraft Unisex Green Printed Backpack,7120.jpg,Handbags,Green,Fall
55268,Women,Personal Care,Makeup,2017.0,Casual,Lakme Absolute Shine Line Smoky Grey Eye Liner,55268.jpg,Kajal and Eyeliner,Brown,Spring
35288,Unisex,Accessories,Watches,2016.0,Casual,Suunto Vector HR White Watch,35288.jpg,Watches,Black,Winter
15945,Men,Accessories,Wallets,2011.0,Casual,Turtle Men Leather Brown Wallets,15945.jpg,Wallets,Brown,Summer
58941,Women,Accessories,Watches,2016.0,Casual,Tommy Hilfiger Women White Dial Watch TH1780808-D,58941.jpg,Watches,White,Winter
26612,Men,Footwear,Shoes,2012.0,Sports,Puma Men Cell Turin Perf 2 Black Sports Shoes,26612.jpg,Casual Shoes,Black,Fall
40669,Women,Apparel,Topwear,2012.0,Casual,Lee Women Navy Blue Printed Shirt,40669.jpg,Tops,Black,Summer
32926,Men,Apparel,Topwear,2012.0,Casual,Status Quo Men Printed Purple T-shirt,32926.jpg,Tshirts,Black,Summer
1947,Men,Apparel,Topwear,2010.0,Sports,Puma Mens Cricket Way of Life T-shirt,1947.jpg,Tshirts,Blue,Summer
34829,Men,Footwear,Shoes,2012.0,Sports,ADIDAS Men Bolt Navy Blue Sports Shoes,34829.jpg,Sports Shoes,White,Summer
32639,Men,Apparel,Topwear,2012.0,Sports,Nike Men Epaulet UV Crew Red T-shirt,32639.jpg,Tshirts,Red,Summer
25204,Women,Accessories,Bags,2015.0,Casual,Lino Perros Women Leatherette Light Brown Handbag,25204.jpg,Handbags,Black,Winter
51956,Women,Accessories,Bags,2012.0,Casual,Yelloe Women Olive Sling Bag,51956.jpg,Handbags,Red,Summer
37243,Men,Footwear,Shoes,2012.0,Casual,United Colors of Benetton Men Brown Shoes,37243.jpg,Casual Shoes,Black,Summer
59964,Women,Apparel,Dress,2012.0,Casual,Avirate Women Black Dress,59964.jpg,Baby Dolls,Pink,Summer
4051,Men,Apparel,Topwear,2011.0,Casual,Myntra Men's Eagle Emblem Yellow T-shirt,4051.jpg,Tshirts,White,Summer
24924,Women,Apparel,Topwear,2012.0,Casual,United Colors of Benetton Women Blue Top,24924.jpg,Tops,White,Summer
38132,Unisex,Accessories,Bags,2015.0,Casual,Wildcraft Unisex Red Zen Backpack,38132.jpg,Backpacks,Red,Fall
22157,Men,Footwear,Shoes,2011.0,Casual,Lee Cooper Men Black Casual Shoes,22157.jpg,Casual Shoes,Black,Summer
31314,Women,Apparel,Topwear,2012.0,Ethnic,W Women Red & Blue Printed Kurta,31314.jpg,Kurtas,Red,Summer
29070,Unisex,Accessories,Bags,2018.0,Casual,Fastrack Unisex Blue Backpack,29070.jpg,Backpacks,Black,Summer
54079,Women,Apparel,Topwear,2012.0,Ethnic,Mumbai Slang Women Black Kurti,54079.jpg,Kurtas,Black,Summer
55359,Women,Personal Care,Nails,2017.0,Casual,Revlon Golden Touch Nail Enamel 384,55359.jpg,Nail Polish,Brown,Spring
57424,Women,Apparel,Topwear,2015.0,Casual,Angry Birds Women Charcoal T-shirt,57424.jpg,Tshirts,Blue,Summer
37341,Boys,Apparel,Topwear,2008.0,Casual,U.S. Polo Assn. Kids Boys Orange T-shirt,37341.jpg,Tshirts,Blue,Summer
46775,Men,Personal Care,Fragrance,2017.0,Casual,Euroluxe Men Ammir Perfume,46775.jpg,Perfume and Body Mist,White,Spring
13654,Men,Footwear,Shoes,2011.0,Casual,ADIDAS Black Speed Boat Casual Shoe,13654.jpg,Sports Shoes,Blue,Summer
18033,Women,Accessories,Bags,2015.0,Casual,Lino Perros Women Solid Brown Handbag,18033.jpg,Handbags,Brown,Winter
8665,Unisex,Accessories,Eyewear,2016.0,Casual,Fastrack Unisex Army collection Brown Sunglasses,8665.jpg,Sunglasses,Black,Winter
45655,Men,Apparel,Innerwear,2016.0,Casual,Park Avenue White Brief,45655.jpg,Trunk,White,Summer
16088,Men,Accessories,Eyewear,2016.0,Casual,M tv Men My Fab Eyewear Black Sunglasses,16088.jpg,Sunglasses,Black,Winter
53361,Women,Accessories,Bags,2012.0,Casual,Puma Women Pink & Grey Backpack,53361.jpg,Backpacks,Red,Summer
24424,Men,Footwear,Shoes,2012.0,Sports,ADIDAS Men Vanquish 5 White Sports Shoes,24424.jpg,Sports Shoes,White,Summer
12716,Men,Footwear,Shoes,2011.0,Sports,Nike Men Air Visi Pro Grey Sports Shoes,12716.jpg,Casual Shoes,White,Fall
31605,Women,Apparel,Bottomwear,2012.0,Sports,Nike Women Running Black Skirt with Capris,31605.jpg,Skirts,Blue,Summer
58487,Men,Accessories,Wallets,2016.0,Casual,Fossil Men Brown Wallet,58487.jpg,Wallets,Brown,Summer
37753,Men,Apparel,Topwear,2012.0,Casual,John Players Men Stripes Blue Shirt,37753.jpg,Shirts,Blue,Summer
52505,Women,Apparel,Loungewear and Nightwear,2015.0,Casual,Red Rose Off-White Printed Bath Robe,52505.jpg,Kurtas,White,Summer
54020,Women,Accessories,Bags,2012.0,Casual,Kiara Women Brown Handbag,54020.jpg,Handbags,White,Summer
55120,Women,Personal Care,Nails,2017.0,Casual,Lakme Truewear Color Crush Nail Polish 20,55120.jpg,Nail Polish,Pink,Spring
6937,Men,Apparel,Topwear,2011.0,Casual,Tantra Men's Destination Mustard T-shirt,6937.jpg,Tshirts,Yellow,Summer
52972,Women,Apparel,Saree,2012.0,Ethnic,FNF Multi Coloured Sari,52972.jpg,Sarees,Red,Fall
23139,Men,Apparel,Topwear,2011.0,Casual,Quechua Men Fleece Olive Sweatshirt,23139.jpg,Shirts,Grey,Fall
4011,Unisex,Sporting Goods,Sports Equipment,2011.0,Sports,Spalding Buror Grey Basketball,4011.jpg,Footballs,Blue,Fall
20263,Men,Apparel,Topwear,2011.0,Casual,Wrangler Men Rust Red T-shirt,20263.jpg,Tshirts,Maroon,Summer
46476,Women,Accessories,Watches,2016.0,Casual,Timex Women White Dial Watch,46476.jpg,Watches,White,Winter
5043,Men,Footwear,Shoes,2013.0,Casual,Fila Men's Sniper White Green Shoe,5043.jpg,Casual Shoes,White,Fall
36277,Women,Apparel,Loungewear and Nightwear,2017.0,Casual,SDL by Sweet Dreams Women Grey & Black Night suits,36277.jpg,Night suits,Black,Summer
58969,Men,Personal Care,Fragrance,2017.0,Casual,Colour Me Men Blue Perfume,58969.jpg,Deodorant,Blue,Spring
16951,Men,Accessories,Eyewear,2016.0,Casual,Image Men Classic Eyewear Black Sunglasses,16951.jpg,Sunglasses,Black,Winter
16203,Men,Apparel,Topwear,2011.0,Casual,Puma Men Logo Hooded Blue SweatShirt,16203.jpg,Sweatshirts,Blue,Fall
54113,Women,Footwear,Shoes,2012.0,Casual,Rocia Women Silver Flats,54113.jpg,Heels,Gold,Winter
36020,Men,Accessories,Belts,2015.0,Casual,OTLS Men Brown Leather Belt,36020.jpg,Belts,Black,Summer
28301,Men,Accessories,Eyewear,2016.0,Casual,Fastrack Men Black Sunglasses M069BK3,28301.jpg,Sunglasses,Black,Winter
53738,Men,Apparel,Bottomwear,2012.0,Casual,ADIDAS Men White Track Pant,53738.jpg,Lounge Pants,White,Fall
10255,Men,Apparel,Topwear,2011.0,Casual,Locomotive Men Stripes Blue Shirts,10255.jpg,Shirts,Blue,Summer
57952,Women,Apparel,Saree,2012.0,Ethnic,Prafful Off White Printed Sari,57952.jpg,Sarees,Green,Fall
9865,Men,Apparel,Topwear,2011.0,Casual,Status Quo Men Grey & Blue Striped T-shirt,9865.jpg,Tshirts,White,Fall
26350,Women,Accessories,Watches,2016.0,Casual,DKNY Women White Dial Watch NY8471,26350.jpg,Watches,White,Winter
33244,Men,Apparel,Topwear,2012.0,Formal,Arrow Men Blue Slim Fit Shirt,33244.jpg,Shirts,Navy Blue,Fall
1595,Men,Apparel,Topwear,2010.0,Sports,Domyos Men Good Stroke Black T-shirt,1595.jpg,Tshirts,Black,Fall
34227,Men,Apparel,Topwear,2013.0,Casual,Proline Men Grey T-shirt,34227.jpg,Tshirts,Blue,Fall
21858,Boys,Apparel,Topwear,2011.0,Casual,Chhota Bheem Kids Boys I Like to Paint Navy Blue T-shirt,21858.jpg,Tshirts,Navy Blue,Summer
32369,Men,Accessories,Watches,2016.0,Casual,Q&Q Men Black Dial Watch,32369.jpg,Watches,Black,Winter
25106,Women,Accessories,Belts,2015.0,Casual,Lino Perros Women Brown Belt,25106.jpg,Belts,Black,Summer
19982,Men,Apparel,Topwear,2011.0,Casual,United Colors of Benetton Men Printed Black TShirt,19982.jpg,Tshirts,Black,Summer
21567,Men,Footwear,Shoes,2012.0,Casual,Numero Uno Men Casual White Shoes,21567.jpg,Casual Shoes,White,Fall
36809,Women,Personal Care,Fragrance,2017.0,Casual,Mont Blanc Women Femme Individuelle Perfume,36809.jpg,Pendant,White,Summer
24155,Women,Apparel,Topwear,2011.0,Ethnic,Aurelia Women Green Kurta,24155.jpg,Kurtas,Green,Fall
49914,Men,Accessories,Watches,2016.0,Casual,Q&Q Men Black Analog Watch,49914.jpg,Watches,Black,Winter
14501,Men,Footwear,Shoes,2011.0,Casual,Flying Machine Men Casual Grey Casual Shoes,14501.jpg,Casual Shoes,Black,Summer
49067,Women,Accessories,Bags,2012.0,Casual,Lino Perros Women Olive Handbag,49067.jpg,Handbags,Black,Summer
26960,Women,Apparel,Topwear,2012.0,Casual,Jealous 21 Women Purple Shirt,26960.jpg,Shirts,Black,Summer
33582,Men,Apparel,Topwear,2012.0,Casual,Wrangler Men True Rider White T-shirt,33582.jpg,Tshirts,White,Summer
19578,Women,Apparel,Topwear,2011.0,Casual,United Colors of Benetton Women Solid Purple Top,19578.jpg,Tops,Black,Summer
43512,Women,Apparel,Dress,2012.0,Casual,French Connection Women Blue Dress,43512.jpg,Kurtas,White,Summer
21313,Women,Accessories,Eyewear,2016.0,Casual,Celine Dion Women Black Frame Sunglasses,21313.jpg,Sunglasses,Black,Winter
16485,Men,Apparel,Topwear,2011.0,Casual,Locomotive Men Check Grey Shirt,16485.jpg,Shirts,Grey,Fall
13547,Women,Footwear,Shoes,2011.0,Casual,Carlton London Women Casual Red Casual Shoes,13547.jpg,Casual Shoes,Red,Summer
43319,Women,Apparel,Topwear,2012.0,Casual,United Colors of Benetton Women White T-shirt,43319.jpg,Tshirts,White,Summer
45811,Women,Footwear,Shoes,2012.0,Casual,Senorita Women Yellow Flats,45811.jpg,Flats,Gold,Winter
57869,Women,Personal Care,Skin,2017.0,Casual,Biotique Bio Saffron Dew Face & Body Cream,57869.jpg,Sunscreen,Pink,Spring
48009,Women,Accessories,Watches,2016.0,Casual,Helix Women Silver Dial Watch,48009.jpg,Watches,White,Winter
33057,Men,Apparel,Topwear,2012.0,Casual,U.S. Polo Assn. Denim Co. Men Black Shirt,33057.jpg,Tshirts,Navy Blue,Summer
40660,Women,Apparel,Topwear,2012.0,Ethnic,Span Women Multi Coloured Kurta,40660.jpg,Kurtas,Multi,Fall
57196,Women,Apparel,Topwear,2012.0,Casual,Elle Women Red Tunic,57196.jpg,Kurtas,Red,Summer
14347,Men,Footwear,Shoes,2011.0,Sports,Nike Men Dual Fusion ST 2 Black Sports Shoes,14347.jpg,Sports Shoes,Black,Fall
55468,Women,Personal Care,Lips,2017.0,Casual,Revlon Super Lusterous Coffee Break Lipstick 303,55468.jpg,Lipstick,Pink,Spring
26931,Women,Apparel,Topwear,2012.0,Casual,Jealous 21 Women Black Top,26931.jpg,Tops,Black,Summer
44415,Men,Footwear,Shoes,2018.0,Casual,Red Tape Men Brown Shoes,44415.jpg,Casual Shoes,Brown,Winter
55784,Men,Footwear,Shoes,2014.0,Casual,Converse Men Black Casual Shoes,55784.jpg,Casual Shoes,Black,Summer
12580,Women,Apparel,Topwear,2011.0,Casual,Tantra Women Blue Printed T-shirt,12580.jpg,Tops,Green,Summer
44770,Men,Footwear,Shoes,2012.0,Casual,Globalite Men Black Skid Shoes,44770.jpg,Casual Shoes,Black,Fall
16201,Men,Apparel,Topwear,2011.0,Casual,Puma Men Polo Black TShirt,16201.jpg,Tshirts,Black,Fall
26347,Women,Accessories,Watches,2016.0,Formal,DKNY Women Beige Dial Chronograph Watch NY8322,26347.jpg,Watches,White,Winter
14928,Men,Apparel,Topwear,2011.0,Casual,Mr. Men Men Beware Grey Melange Tshirts,14928.jpg,Tshirts,Blue,Fall
34565,Women,Apparel,Dress,2012.0,Casual,Tonga Women Printed Black Dress,34565.jpg,Kurtas,Black,Summer
39960,Men,Footwear,Sandal,2013.0,Casual,GAS Men Brown Madly Sandals,39960.jpg,Flip Flops,Brown,Fall
24189,Unisex,Footwear,Shoes,2012.0,Casual,Converse Unisex Chuck Taylor Black Casual Shoes,24189.jpg,Casual Shoes,Black,Summer
7323,Men,Footwear,Shoes,2018.0,Casual,Red Tape Men's Casual Brown Shoe,7323.jpg,Casual Shoes,Brown,Fall
8861,Men,Apparel,Topwear,2011.0,Casual,Mark Taylor Men White Striped Shirt,8861.jpg,Shirts,Blue,Fall
37201,Girls,Apparel,Bottomwear,2012.0,Casual,United Colors of Benetton Girls Washed Blue Jeans,37201.jpg,Jeans,Blue,Summer
42564,Women,Apparel,Topwear,2012.0,Casual,Mother Earth Women Pink Top,42564.jpg,Tops,Green,Fall
21881,Women,Apparel,Topwear,2011.0,Ethnic,BIBA Women sequin Purple Kurta,21881.jpg,Kurtas,Black,Fall
40591,Women,Apparel,Topwear,2012.0,Ethnic,Aurelia Women Blue Kurta,40591.jpg,Tshirts,Green,Summer
17846,Men,Footwear,Shoes,2011.0,Sports,Nike Men Supergame Black Sports Shoe,17846.jpg,Sports Shoes,Black,Fall
15069,Men,Footwear,Sandal,2012.0,Casual,Ganuchi Men Brown Sandal,15069.jpg,Casual Shoes,Brown,Winter
4003,Men,Footwear,Flip Flops,2011.0,Casual,Spalding Men's Navy With Yellow Flip Flop,4003.jpg,Flip Flops,Black,Summer
43154,Women,Accessories,Watches,2016.0,Casual,Fastrack Women Purple Dial Watch,43154.jpg,Watches,Black,Fall
21133,Women,Apparel,Topwear,2011.0,Casual,s.Oliver Women Striped Purple Tshirt,21133.jpg,Sweaters,Navy Blue,Fall
56617,Women,Personal Care,Makeup,2017.0,,Streetwear Stay On Mineral Pink Rosette Blusher,56617.jpg,Highlighter and Blush,Rose,Spring
11951,Men,Footwear,Shoes,2012.0,Casual,Ganuchi Men Blue Shoes,11951.jpg,Casual Shoes,Black,Summer
56921,Women,Footwear,Shoes,2012.0,Casual,HM Women Blue Sandals,56921.jpg,Heels,Black,Winter
33443,Women,Accessories,Bags,2012.0,Casual,Baggit Women Brown Handbag,33443.jpg,Handbags,Black,Summer
46815,Girls,Apparel,Topwear,2012.0,Casual,Gini and Jony Girls Yellow Top,46815.jpg,Tops,White,Summer
26680,Women,Footwear,Shoes,2012.0,Casual,Puma Women Cross Black Flats,26680.jpg,Flats,Black,Summer
32507,Men,Footwear,Sandal,2015.0,Casual,Franco Leone Men Black Sandals,32507.jpg,Sandals,Black,Summer
9425,Men,Apparel,Topwear,2011.0,Formal,John Miller Men Purple Fila-Fil Shirts,9425.jpg,Shirts,Navy Blue,Fall
16989,Men,Footwear,Flip Flops,2012.0,Casual,Puma Men Lynx Black Slipper,16989.jpg,Flip Flops,Brown,Summer
3645,Men,Footwear,Shoes,2011.0,Casual,Fila Men's Maverick HI Black Red Canvas Shoe,3645.jpg,Casual Shoes,White,Fall
29125,Women,Accessories,Eyewear,2016.0,Casual,Vogue Women White Sunglasses,29125.jpg,Sunglasses,Brown,Winter
54600,Men,Apparel,Innerwear,2016.0,Casual,Jockey ELANCE Men Black Briefs 1004,54600.jpg,Briefs,Black,Summer
42228,Women,Apparel,Topwear,2012.0,Casual,Sepia Women White & Green Top,42228.jpg,Tops,Green,Summer
37789,Men,Apparel,Topwear,2012.0,Formal,John Players Men Formal Lavender Shirt,37789.jpg,Shirts,Blue,Fall
45088,Women,Apparel,Innerwear,2015.0,Casual,Bwitch Peach Precious Bra,45088.jpg,Bra,White,Winter
30991,Women,Personal Care,Fragrance,2017.0,,,30991.jpg,Lip Gloss,White,Spring
52480,Women,Apparel,Loungewear and Nightwear,2015.0,Casual,Red Rose Blue & Black Nightdress,52480.jpg,Baby Dolls,Black,Summer
7060,Unisex,Accessories,Bags,2013.0,Sports,Nike Black Classic Turf     NSW  Backpacks,7060.jpg,Backpacks,Blue,Summer
47361,Women,Accessories,Bags,2012.0,Casual,Baggit Women Black Voodoo Gang Handbag,47361.jpg,Handbags,Red,Summer
38466,Women,Accessories,Bags,2012.0,Casual,Baggit Women Red Mobile Pouch,38466.jpg,Laptop Bag,Red,Fall
42670,Women,Apparel,Topwear,2012.0,Ethnic,Alma Women Black Kurta,42670.jpg,Kurtas,White,Summer
33393,Women,Accessories,Bags,2012.0,Casual,Baggit Women Faltu Taj Brown Handbag,33393.jpg,Handbags,Brown,Summer
19837,Men,Apparel,Topwear,2011.0,Casual,U.S. Polo Assn. Men Check Green Shirt,19837.jpg,Shirts,Blue,Fall
48772,Women,Accessories,Jewellery,2013.0,Casual,Lucera Women Silver Pendant,48772.jpg,Pendant,Silver,Winter
55286,Women,Personal Care,Beauty Accessories,2017.0,Casual,Lakme All Over Shimmer Gloss,55286.jpg,Clutches,Green,Winter
7673,Women,Accessories,Socks,2016.0,Casual,Wrangler Women's Agate Green Secret Socks,7673.jpg,Socks,Green,Summer
23769,Women,Accessories,Eyewear,2016.0,Casual,Oakley Women Brown Unfaithful Sunglasses,23769.jpg,Sunglasses,Brown,Winter
22019,Women,Apparel,Topwear,2011.0,Ethnic,Vishudh Women Printed Brown Kurta,22019.jpg,Kurtas,White,Summer
13235,Men,Apparel,Topwear,2011.0,Casual,Palm Tree Kids Boys Stripes Blue Tshirts,13235.jpg,Tshirts,Blue,Summer
20026,Men,Apparel,Topwear,2011.0,Casual,United Colors of Benetton Men Striped White Shirt,20026.jpg,Shirts,White,Summer
57981,Women,Apparel,Topwear,2010.0,Casual,Latin Quarters Women Red Check Shirt,57981.jpg,Tops,Red,Summer
58372,Men,Apparel,Topwear,2012.0,Casual,Locomotive Men Beige T-shirt,58372.jpg,Tshirts,White,Summer
